{
  "meta": {
    "plan_date": "2026-04-15",
    "planner": "Dope Consulting",
    "version": "1.0",
    "confidentiality": "Confidential - Prepared for Growers Solution Leadership Team"
  },
  "client": {
    "name": "Growers Solution",
    "industry": "Sustainable Agriculture / Direct-to-Consumer Produce",
    "stage": "early",
    "arr": 240000,
    "arr_label": "$240,000",
    "founded": "2024",
    "location": "Middle Tennessee",
    "team_size": 6,
    "mission": "Provide the Upper Cumberland region with year-round, locally grown produce through sustainable market garden practices, building food security and economic resilience in rural communities."
  },
  "market": {
    "tam": 4200000000,
    "tam_label": "$4.2B",
    "sam": 680000000,
    "sam_label": "$680M",
    "som": 12000000,
    "som_label": "$12M",
    "competitors": [
      {
        "name": "Regional Grocery Chains (Kroger, Publix)",
        "strength": "Massive distribution, brand recognition, year-round availability",
        "weakness": "Produce travels 1,500+ miles avg, quality degrades, no farm transparency",
        "threat_level": "medium",
        "market_share": "62%"
      },
      {
        "name": "Local Farmers Markets (Nashville, Cookeville)",
        "strength": "Established customer base, community trust, weekend foot traffic",
        "weakness": "Seasonal only (May-Oct), inconsistent supply, no delivery infrastructure",
        "threat_level": "medium",
        "market_share": "8%"
      },
      {
        "name": "CSA Box Programs (various)",
        "strength": "Subscription revenue, loyal customer base, farm-to-table narrative",
        "weakness": "Limited variety, high churn (40%+ annual), no choice in box contents",
        "threat_level": "low",
        "market_share": "3%"
      },
      {
        "name": "Vertical Farming Startups (AppHarvest, regional indoor farms)",
        "strength": "Year-round production, controlled environment, tech narrative",
        "weakness": "Extremely high CAPEX, limited crop variety, energy costs, many have failed",
        "threat_level": "low",
        "market_share": "1%"
      }
    ],
    "trends": [
      "Farm-to-table demand growing 12% YoY in Southeast US metro areas",
      "Restaurant sourcing shifting to local suppliers post-pandemic (68% of chefs prefer local)",
      "Consumer willingness to pay 15-25% premium for locally grown, chemical-free produce",
      "USDA grants for beginning farmers and sustainable agriculture at record levels ($2.1B FY2026)",
      "Climate volatility making long-supply-chain produce less reliable and more expensive",
      "Direct-to-consumer food sales doubled since 2020, now $3B+ annually in the US"
    ],
    "swot": {
      "strengths": [
        "Year-round production capability via high tunnel and greenhouse infrastructure",
        "Direct relationships with 12 restaurant accounts in Cookeville/Nashville corridor",
        "Low overhead: family-operated, owned land, no debt on primary growing infrastructure",
        "Diversified crop rotation (40+ varieties) reduces single-crop risk",
        "Strong social media presence with authentic farm content (8,200 followers)"
      ],
      "weaknesses": [
        "Limited cold chain infrastructure for scaling delivery radius",
        "Single production site creates concentration risk",
        "No formal food safety certification (GAP/GHP) limits institutional sales",
        "Small team with no dedicated sales or marketing hire",
        "Seasonal revenue concentration (65% of revenue in May-September)"
      ],
      "opportunities": [
        "Nashville restaurant market (3,800+ restaurants, growing 9% annually)",
        "Hospital and school district food service contracts (institutional channel)",
        "Agritourism and farm experiences ($950M industry in Tennessee)",
        "Value-added products (sauces, pickled goods, dried herbs) for year-round revenue",
        "USDA Organic certification opens premium wholesale channel"
      ],
      "threats": [
        "Severe weather events (ice storms, drought) can destroy a season's production",
        "Labor availability in rural Tennessee increasingly competitive",
        "Large-scale organic competitors entering the Southeast regional market",
        "Rising input costs (seeds, soil amendments, fuel) compressing margins",
        "Zoning and land use changes in rapidly developing Putnam County"
      ]
    }
  },
  "strategy": {
    "positioning": "Growers Solution will be the Upper Cumberland region's premier year-round market garden, differentiated by hyper-local production (harvested and delivered same day), transparent growing practices, and deep restaurant relationships. We compete not on price against grocery chains, but on freshness, variety, and the economic value of keeping food dollars circulating in the local economy.",
    "pillars": [
      "Year-Round Production Excellence",
      "Restaurant & Institutional Channel Development",
      "Direct-to-Consumer Community Building",
      "Operational Scalability & Infrastructure",
      "Brand & Market Position Strengthening"
    ],
    "pillar_details": [
      {
        "name": "Year-Round Production Excellence",
        "description": "Maximize growing season through high tunnel expansion, succession planting optimization, and winter crop specialization. Target 48-week production calendar by end of Year 2.",
        "initiatives": [
          "Add 2 additional high tunnels (30x96 each) for winter greens and early spring starts",
          "Implement IoT soil monitoring for precision irrigation and fertilization",
          "Develop winter crop specialization: microgreens, cold-hardy greens, root vegetables",
          "Establish seed-starting greenhouse to reduce dependency on external transplant suppliers"
        ]
      },
      {
        "name": "Restaurant & Institutional Channel Development",
        "description": "Grow from 12 to 35 active restaurant accounts and secure 3 institutional contracts (hospital, school, corporate cafeteria) within 18 months.",
        "initiatives": [
          "Hire part-time restaurant sales liaison (Nashville-focused)",
          "Obtain GAP (Good Agricultural Practices) certification for institutional eligibility",
          "Launch chef partnership program: seasonal menu collaboration with top 5 accounts",
          "Develop reliable Tuesday/Friday delivery route Nashville corridor"
        ]
      },
      {
        "name": "Direct-to-Consumer Community Building",
        "description": "Build a subscription-based farm share program with 200+ members and launch an on-farm market/agritourism experience generating $60K+ in supplemental revenue.",
        "initiatives": [
          "Launch customizable weekly farm box subscription (not traditional CSA -- customer picks contents)",
          "Build on-farm market stand with Saturday hours and U-pick experiences",
          "Expand social media to 25,000 followers with weekly farm update content",
          "Host quarterly farm dinners and seasonal workshops"
        ]
      },
      {
        "name": "Operational Scalability & Infrastructure",
        "description": "Invest in cold chain, logistics, and systems to support 3x revenue growth without proportional headcount increase.",
        "initiatives": [
          "Install walk-in cooler and packing station for post-harvest handling",
          "Purchase refrigerated delivery van for Nashville corridor",
          "Implement farm management software for crop planning, inventory, and order management",
          "Develop standard operating procedures for all critical growing and harvesting operations"
        ]
      },
      {
        "name": "Brand & Market Position Strengthening",
        "description": "Establish Growers Solution as a recognized regional brand that commands premium pricing and generates inbound demand from both consumers and chefs.",
        "initiatives": [
          "Pursue USDA Organic certification for premium positioning",
          "Develop professional brand identity and packaging",
          "Launch content marketing program: farm blog, recipe partnerships, local media features",
          "Apply for Tennessee Agricultural Enhancement Program and USDA beginning farmer grants"
        ]
      }
    ],
    "differentiators": [
      "Same-day harvest-to-delivery: produce is in the restaurant kitchen within 6 hours of being picked",
      "40+ crop variety rotation means chefs get seasonal variety no distributor can match",
      "Transparent growing practices: customers can visit the farm any time, no appointment needed",
      "Owner-operated with personal relationships at every account",
      "Year-round production in a market where most local farms shut down November through March"
    ],
    "risks": [
      {
        "name": "Severe Weather / Crop Loss",
        "likelihood": "medium",
        "impact": "critical",
        "mitigation": "Diversified crop rotation across multiple growing structures, crop insurance for high tunnels, 60-day operating reserve fund, relationships with partner farms for emergency sourcing"
      },
      {
        "name": "Key Person Risk",
        "likelihood": "low",
        "impact": "high",
        "mitigation": "Document all SOPs, cross-train family team members on critical operations, establish relationships with experienced farm managers in region for emergency coverage"
      },
      {
        "name": "Nashville Market Saturation",
        "likelihood": "medium",
        "impact": "medium",
        "mitigation": "Focus on exclusive chef relationships rather than commodity sales, differentiate on variety and reliability rather than price, develop institutional channel as hedge"
      },
      {
        "name": "Input Cost Inflation",
        "likelihood": "high",
        "impact": "medium",